### ISSUE TITLE
connection issue when copying $HOME files inside qemu vm

### ISSUE THREAD

**Issue by toddfries** [conformal/cyphertite#21]
I am testing sshfs with fuse and have encountered some issues I'd like to
debug inside a qemu vm instead of my laptop.

So I copied the cyphertite bits inside the qemu vm, and surprisingly it does
not connect.  Is there a timeout too short somewhere or ?

The '-D all' output is below, and below that I've included the network dump
that shows the server is connected to...

Same exact scenario works fine outside qemu.

<code>
$ ct -V
ct version: 1.6.1
Run-time versions:
 assl: 1.3.0
 clog: 0.6.3
 curl: libcurl/7.26.0 OpenSSL/1.0.1c zlib/1.2.3 libidn/1.27
 event: 2.0.21-stable
 exude: 0.7.2
 openssl: OpenSSL 1.0.1c 10 May 2012
 shrink: 0.5.2
 xmlsd: 0.10.0
O/S identification: OpenBSD-i386-5.3 GENERIC.MP#4
$ ct -cvf test.vmtiny -D all tmp
1.042323: &lt; ctutil.c ct_config_parse 279 &gt; filename /home/todd/.cyphertite/cyphertite.conf

1.078540: &lt; exude.c e_free_debug 292 &gt; p 0x80b2ef40 file ct_config.c func ct_load_config line 439
1.114251: &lt; ctutil.c ct_config_parse 279 &gt; filename /home/todd/.cyphertite.conf

1.147079: &lt; ctutil.c ct_settings_add 218 &gt; settings_add: host=auth.cyphertite.com

1.165317: &lt; ctutil.c ct_settings_add 218 &gt; settings_add: hostport=48879

1.177726: &lt; ctutil.c ct_settings_add 218 &gt; settings_add: username=todd

1.198291: &lt; ctutil.c ct_settings_add 218 &gt; settings_add: cache_db=~/.pwd/cyphertite/ct_todd_db

1.222610: &lt; ctutil.c ct_settings_add 218 &gt; settings_add: session_compression=lzma

1.241421: &lt; ctutil.c ct_settings_add 218 &gt; settings_add: crypto_secrets=~/.pwd/cyphertite/ct_todd_crypto

1.261430: &lt; ctutil.c ct_settings_add 218 &gt; settings_add: ca_cert=~/.pwd/cyphertite/ct_ca.crt

1.310951: &lt; ctutil.c ct_settings_add 218 &gt; settings_add: cert=~/.pwd/cyphertite/ct_todd.crt

1.331210: &lt; ctutil.c ct_settings_add 218 &gt; settings_add: key=~/.pwd/cyphertite/private/ct_todd.key

1.358830: &lt; ctutil.c ct_settings_add 218 &gt; settings_add: ctfile_mode=remote

1.394540: &lt; ctutil.c ct_settings_add 218 &gt; settings_add: ctfile_cachedir=~/.mdcache_todd

1.418609: &lt; ctutil.c ct_settings_add 218 &gt; settings_add: ctfile_remote_auto_incremental=1

1.450369: &lt; ctutil.c ct_settings_add 218 &gt; settings_add: upload_crypto_secrets=1

1.467886: &lt; ctutil.c ct_settings_add 218 &gt; settings_add: ctfile_cull_keep_days=365000

1.481957: &lt; ctutil.c ct_settings_add 218 &gt; settings_add: ctfile_differential_allfiles=1

1.499660: &lt; ctutil.c ct_config_parse 322 &gt; loaded config from /home/todd/.cyphertite.conf
1.519591: &lt; exude.c e_calloc_debug 271 &gt; nmemb 1 sz 92 file ct_config.c func ct_load_config line 553 p 0x80bda880
1.544448: &lt; exude.c e_strdup_debug 322 &gt; p 0x8b2d3f60 p /home/todd/.cyphertite.conf
1.843527: &lt; exude.c e_calloc_debug 271 &gt; nmemb 1 sz 1640 file ct_queue.c func ct_setup_state line 76 p 0x849e6000
1.869627: &lt; exude.c e_calloc_debug 271 &gt; nmemb 1 sz 136 file ct_queue.c func ct_setup_state line 79 p 0x7eb2c800
209.035509: &lt; exude.c e_calloc_debug 271 &gt; nmemb 1 sz 360 file ct_event.c func ct_event_init line 295 p 0x87c4ac00
209.397998: &lt; exude.c e_calloc_debug 271 &gt; nmemb 1 sz 40 file ct_db.c func ctdb_setup line 89 p 0x80b2ec00
209.420963: &lt; exude.c e_strdup_debug 322 &gt; p 0x80b2efc0 p /home/todd/.pwd/cyphertite/ct_todd_db
209.825442: &lt; ct_db.c ctdb_check_db_mode 260 &gt; ctdb mode 1

210.845502: &lt; ct_db.c ctdb_check_db_mode 284 &gt; ctdb crypto mode Y Y
210.908398: &lt; ct_db.c ctdb_check_db_mode 348 &gt; Mode check successful
210.964879: &lt; ct_db.c ctdb_open 452 &gt; ctdb_stmt_lookup 0x87162408
211.028437: &lt; ct_db.c ctdb_open 465 &gt; ctdb_stmt_insert 0x87162508
211.068372: &lt; ct_db.c ctdb_open 474 &gt; ctdb_stmt_update 0x87162808
211.083358: &lt; exude.c e_calloc_debug 271 &gt; nmemb 1 sz 140 file ct_util.c func ct_ssl_connect line 532 p 0x87162700
225.779494: &lt; exude.c e_free_debug 292 &gt; p 0x87162700 file ct_util.c func ct_ssl_connect line 554
225.872734: &lt; ct_queue.c ct_trans_cleanup 844 &gt; trans num free  0
225.935133: &lt; ct_queue.c ct_trans_cleanup 853 &gt; freed 0 transactions
225.948655: &lt; ct_db.c ctdb_cleanup 482 &gt; cleaning up ctdb
225.965390: &lt; ct_db.c ctdb_cleanup 488 &gt; finalising stmt_lookup
225.983559: &lt; ct_db.c ctdb_cleanup 493 &gt; finalising stmt_insert
226.003292: &lt; ct_db.c ctdb_cleanup 498 &gt; finalising stmt_update
226.016673: &lt; ct_db.c ctdb_cleanup 504 &gt; closing db
226.110022: &lt; exude.c e_free_debug 292 &gt; p 0x80b2e4c0 file ct_db.c func ctdb_shutdown line 109
226.123578: &lt; exude.c e_free_debug 292 &gt; p 0x80b2ec00 file ct_db.c func ctdb_shutdown line 110
226.168003: &lt; exude.c e_free_debug 292 &gt; p 0x87c4ac00 file ct_event.c func ct_event_cleanup line 405
226.183719: &lt; exude.c e_free_debug 292 &gt; p 0x7eb2c800 file ct_util.c func ct_init line 227
226.203436: &lt; exude.c e_free_debug 292 &gt; p 0x849e6000 file ct_util.c func ct_init line 228
226.215676: &lt; ct_main.c ct_main 441 &gt; failed to initialise cyphertite: Failed to connect
</code>

tcpdump:
<code>
16:38:30.048229 52:54:00:12:34:56 ff:ff:ff:ff:ff:ff 0806 42: arp who-has 10.7.7.1 tell 10.7.7.32
16:38:30.048272 fe:e1:ba:d2:8a:84 52:54:00:12:34:56 0806 42: arp reply 10.7.7.1 is-at fe:e1:ba:d2:8a:84
16:38:30.061351 52:54:00:12:34:56 fe:e1:ba:d2:8a:84 0800 79: 10.7.7.32.38466 > 10.7.7.1.53: [udp sum ok] 48624+ A? auth.cyphertite.com. (37) (ttl 64, id 20715, len 65)
16:38:30.061537 fe:e1:ba:d2:8a:84 52:54:00:12:34:56 0800 95: 10.7.7.1.53 > 10.7.7.32.38466: [udp sum ok] 48624 1/0/0 auth.cyphertite.com. A 204.124.83.20 (53) (ttl 64, id 32373, len 81)
16:38:30.113341 52:54:00:12:34:56 fe:e1:ba:d2:8a:84 0800 79: 10.7.7.32.27029 > 10.7.7.1.53: [udp sum ok] 27391+ AAAA? auth.cyphertite.com. (37) (ttl 64, id 6674, len 65)
16:38:30.113527 fe:e1:ba:d2:8a:84 52:54:00:12:34:56 0800 107: 10.7.7.1.53 > 10.7.7.32.27029: [udp sum ok] 27391 1/0/0 auth.cyphertite.com. AAAA 2620:d:8000:169::20 (65) (ttl 64, id 62375, len 93)
16:38:30.155819 52:54:00:12:34:56 fe:e1:ba:d2:8a:84 0800 78: 10.7.7.32.10871 > 204.124.83.20.48879: S [tcp sum ok] 2015252449:2015252449(0) win 16384 <mss 1460,nop,nop,sackOK,nop,wscale 3,nop,nop,timestamp 3032614803 0> (DF) [tos 0x8](ttl 64, id 889, len 64)
16:38:30.252853 fe:e1:ba:d2:8a:84 52:54:00:12:34:56 0800 78: 204.124.83.20.48879 > 10.7.7.32.10871: S [tcp sum ok] 870528921:870528921(0) ack 2015252450 win 16384 <mss 1460,nop,nop,sackOK,nop,wscale 3,nop,nop,timestamp 3731024549 3032614803> (ttl 54, id 25879, len 64)
16:38:30.278001 52:54:00:12:34:56 fe:e1:ba:d2:8a:84 0800 66: 10.7.7.32.10871 > 204.124.83.20.48879: . [tcp sum ok] ack 1 win 2048 <nop,nop,timestamp 3032614803 3731024549> (DF) [tos 0x8](ttl 64, id 11198, len 52)
16:38:30.906630 52:54:00:12:34:56 fe:e1:ba:d2:8a:84 0800 263: 10.7.7.32.10871 > 204.124.83.20.48879: P [tcp sum ok] 1:198(197) ack 1 win 2048 <nop,nop,timestamp 3032614804 3731024549> (DF) [tos 0x8](ttl 64, id 690, len 249)
16:38:30.978084 fe:e1:ba:d2:8a:84 52:54:00:12:34:56 0800 66: 204.124.83.20.48879 > 10.7.7.32.10871: . [tcp sum ok] ack 198 win 2147 <nop,nop,timestamp 3731024551 3032614804> (ttl 54, id 43169, len 52)
16:38:30.989129 fe:e1:ba:d2:8a:84 52:54:00:12:34:56 0800 1514: 204.124.83.20.48879 > 10.7.7.32.10871: . 1:1449(1448) ack 198 win 2172 <nop,nop,timestamp 3731024551 3032614804> (ttl 54, id 9921, len 1500)
16:38:30.991655 fe:e1:ba:d2:8a:84 52:54:00:12:34:56 0800 1514: 204.124.83.20.48879 > 10.7.7.32.10871: . 1:1449(1448) ack 198 win 2172 <nop,nop,timestamp 3731024551 3032614804> (ttl 54, id 9921, len 1500)
16:38:31.049300 52:54:00:12:34:56 fe:e1:ba:d2:8a:84 0800 66: 10.7.7.32.10871 > 204.124.83.20.48879: . [tcp sum ok] ack 1603 win 1847 <nop,nop,timestamp 3032614804 3731024551> (DF) [tos 0x8](ttl 64, id 20834, len 52)
16:38:40.441241 fe:e1:ba:d2:8a:84 52:54:00:12:34:56 0800 66: 204.124.83.20.48879 > 10.7.7.32.10871: F [tcp sum ok] 1603:1603(0) ack 198 win 2172 <nop,nop,timestamp 3731024570 3032614804> (ttl 54, id 58862, len 52)
16:38:40.466043 52:54:00:12:34:56 fe:e1:ba:d2:8a:84 0800 66: 10.7.7.32.10871 > 204.124.83.20.48879: . [tcp sum ok] ack 1604 win 2048 <nop,nop,timestamp 3032614814 3731024570> (DF) [tos 0x8](ttl 64, id 34627, len 52)
16:38:43.445905 52:54:00:12:34:56 fe:e1:ba:d2:8a:84 0800 1514: 10.7.7.32.10871 > 204.124.83.20.48879: . 198:1646(1448) ack 1604 win 2048 <nop,nop,timestamp 3032614817 3731024570> (DF) [tos 0x8](ttl 64, id 4827, len 1500)
16:38:43.445981 52:54:00:12:34:56 fe:e1:ba:d2:8a:84 0800 162: 10.7.7.32.10871 > 204.124.83.20.48879: P [tcp sum ok] 1646:1742(96) ack 1604 win 2048 <nop,nop,timestamp 3032614817 3731024570> (DF) [tos 0x8](ttl 64, id 12913, len 148)
16:38:43.469034 52:54:00:12:34:56 fe:e1:ba:d2:8a:84 0800 66: 10.7.7.32.10871 > 204.124.83.20.48879: F [tcp sum ok] 1742:1742(0) ack 1604 win 2048 <nop,nop,timestamp 3032614817 3731024570> (DF) [tos 0x8](ttl 64, id 21634, len 52)
16:38:43.528701 fe:e1:ba:d2:8a:84 52:54:00:12:34:56 0800 54: 204.124.83.20.48879 > 10.7.7.32.10871: R [tcp sum ok] 870530525:870530525(0) win 0 (ttl 54, id 12841, len 40)
16:38:43.529574 fe:e1:ba:d2:8a:84 52:54:00:12:34:56 0800 54: 204.124.83.20.48879 > 10.7.7.32.10871: R [tcp sum ok] 870530525:870530525(0) win 0 (ttl 54, id 12841, len 40)
16:38:43.544425 fe:e1:ba:d2:8a:84 52:54:00:12:34:56 0800 54: 204.124.83.20.48879 > 10.7.7.32.10871: R [tcp sum ok] 870530525:870530525(0) win 0 (ttl 54, id 28154, len 40)

</code>

**Comment by toddfries** [comment]
after debugging for a long time with dhill it is clear that there is something odd about qemu and openssl, even simply using 'openssl s_connect -connect auth.cyphertite.com:48879 -CAfile ct_ca.crt -cert ct_todd.crt -key private/ct_todd.key' has oddly different output in the qemu vm case versus the physical hardware, tls tickets do not appear in the vm for one glaring example .. so making this big bold comment DO NOT WORK ON THIS AS IF IT IS A CYPHERTITE BUG until proven otherwise, it looks like some generic openssl issue.  After consulting with dhill, I prefer to leave this open as a warning against others trying to use cyphertite inside qemu until the ssl issue is resolved.
